{
  "$schema": "../../document.schema.json",
  "title": "AXTreeViewSelectionScope",
  "description": "Defines the scope of selection for tree view components.",
  "imports": ["import { AXTreeViewSelectionScope } from '@acorex/components/tree-view';"],
  "types": [
    {
      "title": "AXTreeViewSelectionScope",
      "props": [
        {
          "name": "AXTreeViewSelectionScope",
          "type": [{ "name": "'all'" }, { "name": "'parent'" }, { "name": "'children'" }],
          "description": "Selection scope options for tree view components."
        }
      ]
    }
  ],
  "sections": [
    {
      "title": "Type Definition",
      "description": "TypeScript definition of the selection scope type.",
      "content": {
        "type": "code",
        "data": [
          {
            "language": "typescript",
            "fileName": "tree-view.class.ts",
            "content": "export type AXTreeViewSelectionScope = 'all' | 'parent' | 'children';"
          }
        ]
      }
    }
  ]
}
